{
  "$schema": "https://eoip.enterprise.internal/schemas/verification-receipt-v3.json",
  "receipt_id": "rcpt-f3ace8b6-65fa-45d0-97f0-065ae5207bc8",
  "requirement_clause": "CRA-020.2",
  "state_claimed": "VERIFIED",
  "profile": "P0",
  "source_commit": "75bb57d16685c30576b4abe42e75df5d5c9a9898",
  "source_tree_dirty": false,
  "source_fingerprint": "f6455c0385bda66815dccd6d3c6c4700e8864007457ba9bf99319833bb2f7bb4",
  "source_unchanged_during_run": true,
  "artifact_digest": "c0dc68fe08adc165f1198875e028f57bdd75edb22a2e9f31080c321ee8659a21",
  "artifact_path": "dist/eoip-1.0.0rc1-py3-none-any.whl",
  "artifact_mtime": "2026-10-20T07:37:58.966120+00:00",
  "runtime": {
    "os": "Linux-6.12.94+-x86_64-with-glibc2.41",
    "python_version": "3.11.17",
    "backend": "memory-harness",
    "engine": "",
    "engine_version": ""
  },
  "fixture": {
    "id": ""
  },
  "execution": {
    "command": [
      "/workspace/.venvs/eiop-work/bin/python",
      "-m",
      "pytest",
      "-p",
      "no:cacheprovider",
      "-q",
      "-o",
      "addopts=",
      "--timeout=300",
      "tests/semantic/test_shacl_strict.py::test_shacl_closed_shapes",
      "tests/semantic/test_shacl_strict.py::test_shacl_logical_constraints",
      "tests/semantic/test_shacl_strict.py::test_shacl_node_kind_and_patterns_and_lengths",
      "tests/semantic/test_shacl_strict.py::test_shacl_numeric_bounds",
      "tests/semantic/test_shacl_strict.py::test_shacl_unsupported_constraint_rejected",
      "--junitxml",
      ".audit-scratch/evidence/CRA-020.2/run-20261020T073836Z-e309dad9/junit.xml"
    ],
    "exit_code": 0,
    "started_at": "2026-10-20T07:38:36.119840+00:00",
    "completed_at": "2026-10-20T07:38:37.051856+00:00"
  },
  "results": {
    "tests_total": 5,
    "tests_failed": 0,
    "tests_errors": 0,
    "tests_skipped": 0,
    "tests_xfailed": 0,
    "tests_passed": 5
  },
  "evidence_files": [
    {
      "path": ".audit-scratch/evidence/CRA-020.2/run-20261020T073836Z-e309dad9/junit.xml",
      "sha256": "fe07bab73ab47012f6325741aaaa4ab4fb88e5b83082ca5a7ed71ad46472c4a8"
    },
    {
      "path": ".audit-scratch/evidence/CRA-020.2/run-20261020T073836Z-e309dad9/stderr.txt",
      "sha256": "e3b0c44298fc1c149afbf4c8996fb92427ae41e4649b934ca495991b7852b855"
    },
    {
      "path": ".audit-scratch/evidence/CRA-020.2/run-20261020T073836Z-e309dad9/stdout.txt",
      "sha256": "2ef77ac648ca8d1dbf982c5c15ac725960e41d419a638042157bf4fd84d08603"
    }
  ],
  "verified_invariants": [],
  "negative_cases": [],
  "evidence_categories": {},
  "limitations": [],
  "producer": "antigravity-agent",
  "reviewer": null,
  "review_signature": null
}