{
  "$schema": "https://eoip.enterprise.internal/schemas/verification-receipt-v3.json",
  "receipt_id": "rcpt-20628203-3b25-4486-a22a-1c96327901c6",
  "requirement_clause": "CRA-001.3",
  "state_claimed": "VERIFIED",
  "profile": "P0",
  "source_commit": "75bb57d16685c30576b4abe42e75df5d5c9a9898",
  "source_tree_dirty": false,
  "source_fingerprint": "f6455c0385bda66815dccd6d3c6c4700e8864007457ba9bf99319833bb2f7bb4",
  "source_unchanged_during_run": true,
  "artifact_digest": "c0dc68fe08adc165f1198875e028f57bdd75edb22a2e9f31080c321ee8659a21",
  "artifact_path": "dist/eoip-1.0.0rc1-py3-none-any.whl",
  "artifact_mtime": "2026-10-20T07:37:58.966120+00:00",
  "runtime": {
    "os": "Linux-6.12.94+-x86_64-with-glibc2.41",
    "python_version": "3.11.17",
    "backend": "memory-harness",
    "engine": "",
    "engine_version": ""
  },
  "fixture": {
    "id": ""
  },
  "execution": {
    "command": [
      "/workspace/.venvs/eiop-work/bin/python",
      "-m",
      "pytest",
      "tests/acceptance/test_verify_ledger.py",
      "--junitxml",
      ".audit-scratch/evidence/CRA-001.3/run-20261020T073802Z-baa3a8dd/junit.xml"
    ],
    "exit_code": 0,
    "started_at": "2026-10-20T07:38:02.852669+00:00",
    "completed_at": "2026-10-20T07:38:04.051491+00:00"
  },
  "results": {
    "tests_total": 9,
    "tests_failed": 0,
    "tests_errors": 0,
    "tests_skipped": 0,
    "tests_xfailed": 0,
    "tests_passed": 9
  },
  "evidence_files": [
    {
      "path": ".audit-scratch/evidence/CRA-001.3/run-20261020T073802Z-baa3a8dd/junit.xml",
      "sha256": "37f3f84e9a68183fb97b7e720a03296a062242c5efaf872edb787282f8c4e9bf"
    },
    {
      "path": ".audit-scratch/evidence/CRA-001.3/run-20261020T073802Z-baa3a8dd/stderr.txt",
      "sha256": "e3b0c44298fc1c149afbf4c8996fb92427ae41e4649b934ca495991b7852b855"
    },
    {
      "path": ".audit-scratch/evidence/CRA-001.3/run-20261020T073802Z-baa3a8dd/stdout.txt",
      "sha256": "224bc59a47f9c3b44cab0a226719e341dbcae225610b9bbfa6baf78bb536faa4"
    }
  ],
  "verified_invariants": [],
  "negative_cases": [],
  "evidence_categories": {},
  "limitations": [],
  "producer": "antigravity-agent",
  "reviewer": null,
  "review_signature": null
}