{
  "$schema": "https://eoip.enterprise.internal/schemas/verification-receipt-v3.json",
  "receipt_id": "rcpt-3dba3c93-e776-4b11-8a32-291bd5ddc250",
  "requirement_clause": "CRA-017.10",
  "state_claimed": "VERIFIED",
  "profile": "P0",
  "source_commit": "75bb57d16685c30576b4abe42e75df5d5c9a9898",
  "source_tree_dirty": false,
  "source_fingerprint": "f6455c0385bda66815dccd6d3c6c4700e8864007457ba9bf99319833bb2f7bb4",
  "source_unchanged_during_run": true,
  "artifact_digest": "c0dc68fe08adc165f1198875e028f57bdd75edb22a2e9f31080c321ee8659a21",
  "artifact_path": "dist/eoip-1.0.0rc1-py3-none-any.whl",
  "artifact_mtime": "2026-10-20T07:37:58.966120+00:00",
  "runtime": {
    "os": "Linux-6.12.94+-x86_64-with-glibc2.41",
    "python_version": "3.11.17",
    "backend": "memory-harness",
    "engine": "",
    "engine_version": ""
  },
  "fixture": {
    "id": ""
  },
  "execution": {
    "command": [
      "/workspace/.venvs/eiop-work/bin/python",
      "-m",
      "pytest",
      "-p",
      "no:cacheprovider",
      "-q",
      "-o",
      "addopts=",
      "--timeout=300",
      "tests/mapping/test_mapping_advanced.py::test_ai_suggested_mappings_proposal",
      "--junitxml",
      ".audit-scratch/evidence/CRA-017.10/run-20261020T073832Z-9560e425/junit.xml"
    ],
    "exit_code": 0,
    "started_at": "2026-10-20T07:38:32.895600+00:00",
    "completed_at": "2026-10-20T07:38:33.811202+00:00"
  },
  "results": {
    "tests_total": 1,
    "tests_failed": 0,
    "tests_errors": 0,
    "tests_skipped": 0,
    "tests_xfailed": 0,
    "tests_passed": 1
  },
  "evidence_files": [
    {
      "path": ".audit-scratch/evidence/CRA-017.10/run-20261020T073832Z-9560e425/junit.xml",
      "sha256": "5e13421cfcfeefde5d35e152aa087aa0709f9fdcb6ef39f6d200649b825c7fa9"
    },
    {
      "path": ".audit-scratch/evidence/CRA-017.10/run-20261020T073832Z-9560e425/stderr.txt",
      "sha256": "e3b0c44298fc1c149afbf4c8996fb92427ae41e4649b934ca495991b7852b855"
    },
    {
      "path": ".audit-scratch/evidence/CRA-017.10/run-20261020T073832Z-9560e425/stdout.txt",
      "sha256": "d4a7aa584561aca21605d8787ed44b1a7d312e24c3ae723cee038a92c878c23d"
    }
  ],
  "verified_invariants": [],
  "negative_cases": [],
  "evidence_categories": {},
  "limitations": [],
  "producer": "antigravity-agent",
  "reviewer": null,
  "review_signature": null
}