{
  "$schema": "https://eoip.enterprise.internal/schemas/verification-receipt-v3.json",
  "receipt_id": "rcpt-2beed96e-2c39-4170-8bc5-25076d2430a4",
  "requirement_clause": "CRA-038.1",
  "state_claimed": "VERIFIED",
  "profile": "P0",
  "source_commit": "75bb57d16685c30576b4abe42e75df5d5c9a9898",
  "source_tree_dirty": false,
  "source_fingerprint": "f6455c0385bda66815dccd6d3c6c4700e8864007457ba9bf99319833bb2f7bb4",
  "source_unchanged_during_run": true,
  "artifact_digest": "c0dc68fe08adc165f1198875e028f57bdd75edb22a2e9f31080c321ee8659a21",
  "artifact_path": "dist/eoip-1.0.0rc1-py3-none-any.whl",
  "artifact_mtime": "2026-10-20T07:37:58.966120+00:00",
  "runtime": {
    "os": "Linux-6.12.94+-x86_64-with-glibc2.41",
    "python_version": "3.11.17",
    "backend": "memory-harness",
    "engine": "",
    "engine_version": ""
  },
  "fixture": {
    "id": ""
  },
  "execution": {
    "command": [
      "/workspace/.venvs/eiop-work/bin/python",
      "-m",
      "pytest",
      "-p",
      "no:cacheprovider",
      "-q",
      "-o",
      "addopts=",
      "--timeout=300",
      "tests/acceptance/test_operator_readiness_acceptance.py::test_cra_038_1_service_responsibility_matrix",
      "--junitxml",
      ".audit-scratch/evidence/CRA-038.1/run-20261020T073904Z-3c5904c3/junit.xml"
    ],
    "exit_code": 0,
    "started_at": "2026-10-20T07:39:04.852100+00:00",
    "completed_at": "2026-10-20T07:39:05.748009+00:00"
  },
  "results": {
    "tests_total": 1,
    "tests_failed": 0,
    "tests_errors": 0,
    "tests_skipped": 0,
    "tests_xfailed": 0,
    "tests_passed": 1
  },
  "evidence_files": [
    {
      "path": ".audit-scratch/evidence/CRA-038.1/run-20261020T073904Z-3c5904c3/junit.xml",
      "sha256": "ad3f6619069dc54ac27a8e945d4f5fc53cdd9e715e2e13bef06b82529323b475"
    },
    {
      "path": ".audit-scratch/evidence/CRA-038.1/run-20261020T073904Z-3c5904c3/stderr.txt",
      "sha256": "e3b0c44298fc1c149afbf4c8996fb92427ae41e4649b934ca495991b7852b855"
    },
    {
      "path": ".audit-scratch/evidence/CRA-038.1/run-20261020T073904Z-3c5904c3/stdout.txt",
      "sha256": "9a23ae95f1a5f31be5fb65b6efe3e6770035f0e3e76b9ff76ae00a31c9167ad5"
    }
  ],
  "verified_invariants": [],
  "negative_cases": [],
  "evidence_categories": {},
  "limitations": [],
  "producer": "antigravity-agent",
  "reviewer": null,
  "review_signature": null
}