{
  "$schema": "https://eoip.enterprise.internal/schemas/verification-receipt-v3.json",
  "receipt_id": "rcpt-593d0adf-12aa-4c9f-8173-63675b77c007",
  "requirement_clause": "CRA-044.10",
  "state_claimed": "VERIFIED",
  "profile": "P0",
  "source_commit": "77f3985a7f7407be0509ec04ea4cceaa0313ee6e",
  "source_tree_dirty": false,
  "source_fingerprint": "8acc4c5d95fcd6a484540b576f5f237880389d183af0efb2f906ab0cbd8f28ff",
  "source_unchanged_during_run": true,
  "artifact_digest": "c0dc68fe08adc165f1198875e028f57bdd75edb22a2e9f31080c321ee8659a21",
  "artifact_path": "dist/eoip-1.0.0rc1-py3-none-any.whl",
  "artifact_mtime": "2026-10-20T07:37:58.966120+00:00",
  "runtime": {
    "os": "Linux-6.12.94+-x86_64-with-glibc2.41",
    "python_version": "3.11.17",
    "backend": "memory-harness",
    "engine": "",
    "engine_version": ""
  },
  "fixture": {
    "id": ""
  },
  "execution": {
    "command": [
      "/workspace/.venvs/eiop-work/bin/python",
      "-m",
      "pytest",
      "-p",
      "no:cacheprovider",
      "-q",
      "-o",
      "addopts=",
      "--timeout=300",
      "tests/neural/test_learned_graph_intelligence.py::test_cra_044_10_explainability_faithfulness",
      "--junitxml",
      ".audit-scratch/evidence/CRA-044.10/run-20261020T074132Z-d59bf22d/junit.xml"
    ],
    "exit_code": 0,
    "started_at": "2026-10-20T07:41:32.933431+00:00",
    "completed_at": "2026-10-20T07:41:35.473951+00:00"
  },
  "results": {
    "tests_total": 1,
    "tests_failed": 0,
    "tests_errors": 0,
    "tests_skipped": 0,
    "tests_xfailed": 0,
    "tests_passed": 1
  },
  "evidence_files": [
    {
      "path": ".audit-scratch/evidence/CRA-044.10/run-20261020T074132Z-d59bf22d/junit.xml",
      "sha256": "24f21de2d30609ea104ca44c203d35cca23d24dc78aa6fe8b49dd403407b0a16"
    },
    {
      "path": ".audit-scratch/evidence/CRA-044.10/run-20261020T074132Z-d59bf22d/stderr.txt",
      "sha256": "e3b0c44298fc1c149afbf4c8996fb92427ae41e4649b934ca495991b7852b855"
    },
    {
      "path": ".audit-scratch/evidence/CRA-044.10/run-20261020T074132Z-d59bf22d/stdout.txt",
      "sha256": "1b82d9710dced97c47adbd16f23cf6937718014edd6117562856ebaf0732d7d6"
    }
  ],
  "verified_invariants": [],
  "negative_cases": [],
  "evidence_categories": {},
  "limitations": [],
  "producer": "antigravity-agent",
  "reviewer": null,
  "review_signature": null
}