{
  "$schema": "https://eoip.enterprise.internal/schemas/verification-receipt-v3.json",
  "receipt_id": "rcpt-d539035a-05ed-4407-b8a2-c228a4412088",
  "requirement_clause": "CRA-022.A",
  "state_claimed": "VERIFIED",
  "profile": "P0",
  "source_commit": "75bb57d16685c30576b4abe42e75df5d5c9a9898",
  "source_tree_dirty": false,
  "source_fingerprint": "f6455c0385bda66815dccd6d3c6c4700e8864007457ba9bf99319833bb2f7bb4",
  "source_unchanged_during_run": true,
  "artifact_digest": "c0dc68fe08adc165f1198875e028f57bdd75edb22a2e9f31080c321ee8659a21",
  "artifact_path": "dist/eoip-1.0.0rc1-py3-none-any.whl",
  "artifact_mtime": "2026-10-20T07:37:58.966120+00:00",
  "runtime": {
    "os": "Linux-6.12.94+-x86_64-with-glibc2.41",
    "python_version": "3.11.17",
    "backend": "memory-harness",
    "engine": "",
    "engine_version": ""
  },
  "fixture": {
    "id": ""
  },
  "execution": {
    "command": [
      "/workspace/.venvs/eiop-work/bin/python",
      "-m",
      "pytest",
      "-p",
      "no:cacheprovider",
      "-q",
      "-o",
      "addopts=",
      "--timeout=300",
      "tests/integration/test_gitops_pr_gate.py::test_version_store_atomic_publication_consumer_acknowledgement_and_rollback",
      "--junitxml",
      ".audit-scratch/evidence/CRA-022.A/run-20261020T073922Z-9d8ba7d9/junit.xml"
    ],
    "exit_code": 0,
    "started_at": "2026-10-20T07:39:22.410006+00:00",
    "completed_at": "2026-10-20T07:39:23.342549+00:00"
  },
  "results": {
    "tests_total": 1,
    "tests_failed": 0,
    "tests_errors": 0,
    "tests_skipped": 0,
    "tests_xfailed": 0,
    "tests_passed": 1
  },
  "evidence_files": [
    {
      "path": ".audit-scratch/evidence/CRA-022.A/run-20261020T073922Z-9d8ba7d9/junit.xml",
      "sha256": "6441e088dccb0a253349225c8ea141df823649fcc72f2f226ef04d792d2cd322"
    },
    {
      "path": ".audit-scratch/evidence/CRA-022.A/run-20261020T073922Z-9d8ba7d9/stderr.txt",
      "sha256": "e3b0c44298fc1c149afbf4c8996fb92427ae41e4649b934ca495991b7852b855"
    },
    {
      "path": ".audit-scratch/evidence/CRA-022.A/run-20261020T073922Z-9d8ba7d9/stdout.txt",
      "sha256": "713c224371654619ac2fe7ade35bbabb17c3db8ea40d0c4472063f53c4c8854f"
    }
  ],
  "verified_invariants": [],
  "negative_cases": [],
  "evidence_categories": {},
  "limitations": [],
  "producer": "antigravity-agent",
  "reviewer": null,
  "review_signature": null
}